{
  "name": "Default",
  "description": "Teal and slate. Every token is defined here; other schemes extend it and override what they need.",
  "light": {
    "bg": "#f4f6f8",
    "surface": "#ffffff",
    "surface-2": "#f0f3f6",
    "border": "#d9dee4",
    "text": "#1d2733",
    "text-2": "#56636f",
    "accent": "#0b6e79",
    "on-accent": "#ffffff",
    "highlight": "#0b6e79",
    "focus": "#0b6e79",
    "header-bg": "#13323a",
    "header-text": "#eef6f7",
    "header-hover": "rgba(255, 255, 255, 0.08)",
    "passed": "#2e7d32",
    "failed": "#c62828",
    "flaky": "#b26a00",
    "skipped": "#6b7785",
    "on-status": "#ffffff",
    "passed-soft": "#e3f1e4",
    "failed-soft": "#fbe5e5",
    "flaky-soft": "#fbefdc",
    "skipped-soft": "#eceff2",
    "code-bg": "#f6f8fa",
    "api": "#5b3fa8",
    "browser": "#0f6e8c",
    "shadow": "0 1px 2px rgba(16, 24, 40, 0.06), 0 1px 3px rgba(16, 24, 40, 0.08)"
  },
  "dark": {
    "bg": "#0f1418",
    "surface": "#171e24",
    "surface-2": "#1e272e",
    "border": "#2c3740",
    "text": "#e3e8ec",
    "text-2": "#9aa7b2",
    "accent": "#4fc1cc",
    "on-accent": "#0f1418",
    "highlight": "#4fc1cc",
    "focus": "#4fc1cc",
    "header-bg": "#0b2228",
    "header-text": "#e3f1f3",
    "header-hover": "rgba(255, 255, 255, 0.08)",
    "passed": "#5cb860",
    "failed": "#ef5350",
    "flaky": "#f0a030",
    "skipped": "#8d99a5",
    "on-status": "#0f1418",
    "passed-soft": "#1c3320",
    "failed-soft": "#3a1d1d",
    "flaky-soft": "#3a2c14",
    "skipped-soft": "#252d34",
    "code-bg": "#11171c",
    "api": "#a993ef",
    "browser": "#6cc4e0",
    "shadow": "none"
  }
}
